{
    "$schema": "https://json-schema.org/draft/2020-12/schema",
    "$id": "boss-status-display.schema.json",
    "title": "Boss Status Display Configuration",
    "description": "Configuration for boss status UI elements including phase indicator, enrage timer, and vulnerability window",
    "type": "object",
    "properties": {
        "phaseIndicator": {
            "type": "object",
            "description": "Phase indicator position and size",
            "properties": {
                "startX": {
                    "type": "integer",
                    "minimum": 0,
                    "default": 0
                },
                "startY": {
                    "type": "integer",
                    "minimum": 0,
                    "default": 7
                },
                "width": {
                    "type": "integer",
                    "minimum": 20,
                    "maximum": 100,
                    "default": 50
                },
                "height": {
                    "type": "integer",
                    "minimum": 2,
                    "maximum": 10,
                    "default": 5
                },
                "maxHints": {
                    "type": "integer",
                    "minimum": 1,
                    "maximum": 5,
                    "default": 3
                }
            },
            "additionalProperties": false
        },
        "enrageTimer": {
            "type": "object",
            "description": "Enrage timer position and warning settings",
            "properties": {
                "startX": {
                    "type": "integer",
                    "minimum": 0,
                    "default": 0
                },
                "startY": {
                    "type": "integer",
                    "minimum": 0,
                    "default": 12
                },
                "width": {
                    "type": "integer",
                    "minimum": 20,
                    "maximum": 100,
                    "default": 60
                },
                "height": {
                    "type": "integer",
                    "minimum": 1,
                    "maximum": 5,
                    "default": 2
                },
                "warningThreshold": {
                    "type": "integer",
                    "description": "Health percentage at which to show enrage warning",
                    "minimum": 1,
                    "maximum": 50,
                    "default": 10
                }
            },
            "additionalProperties": false
        },
        "vulnerabilityWindow": {
            "type": "object",
            "description": "Vulnerability window display settings",
            "properties": {
                "startX": {
                    "type": "integer",
                    "minimum": 0,
                    "default": 0
                },
                "startY": {
                    "type": "integer",
                    "minimum": 0,
                    "default": 14
                },
                "width": {
                    "type": "integer",
                    "minimum": 30,
                    "maximum": 120,
                    "default": 70
                },
                "damageMultiplier": {
                    "type": "number",
                    "description": "Damage multiplier during vulnerability",
                    "minimum": 1.0,
                    "maximum": 5.0,
                    "default": 1.5
                },
                "closedDisplayMs": {
                    "type": "integer",
                    "description": "Duration to show 'window closed' message",
                    "minimum": 0,
                    "maximum": 5000,
                    "default": 1000
                },
                "flashIntervalMs": {
                    "type": "integer",
                    "description": "Flash interval for urgent warnings",
                    "minimum": 50,
                    "maximum": 1000,
                    "default": 200
                }
            },
            "additionalProperties": false
        },
        "transitionEffect": {
            "type": "object",
            "description": "Phase transition effect display settings",
            "properties": {
                "centerX": {
                    "type": "integer",
                    "description": "Center X coordinate for transition box",
                    "minimum": 0,
                    "default": 40
                },
                "startY": {
                    "type": "integer",
                    "minimum": 0,
                    "default": 5
                },
                "boxWidth": {
                    "type": "integer",
                    "description": "Width of the transition effect box",
                    "minimum": 40,
                    "maximum": 80,
                    "default": 55
                },
                "displayDurationMs": {
                    "type": "integer",
                    "description": "Duration to display transition effect",
                    "minimum": 500,
                    "maximum": 5000,
                    "default": 2000
                }
            },
            "additionalProperties": false
        },
        "colors": {
            "type": "object",
            "description": "Color configuration for status elements",
            "properties": {
                "aggressiveColor": {
                    "$ref": "#/$defs/consoleColor",
                    "default": "Red"
                },
                "tacticalColor": {
                    "$ref": "#/$defs/consoleColor",
                    "default": "Cyan"
                },
                "defensiveColor": {
                    "$ref": "#/$defs/consoleColor",
                    "default": "Blue"
                },
                "enragedColor": {
                    "$ref": "#/$defs/consoleColor",
                    "default": "DarkRed"
                },
                "summonerColor": {
                    "$ref": "#/$defs/consoleColor",
                    "default": "Magenta"
                },
                "vulnerableColor": {
                    "$ref": "#/$defs/consoleColor",
                    "default": "Yellow"
                },
                "urgentColor": {
                    "$ref": "#/$defs/consoleColor",
                    "default": "Red"
                },
                "windowClosedColor": {
                    "$ref": "#/$defs/consoleColor",
                    "default": "Gray"
                },
                "transitionBoxColor": {
                    "$ref": "#/$defs/consoleColor",
                    "default": "White"
                },
                "criticalWarningColor": {
                    "$ref": "#/$defs/consoleColor",
                    "default": "Red"
                },
                "highWarningColor": {
                    "$ref": "#/$defs/consoleColor",
                    "default": "DarkYellow"
                },
                "lowWarningColor": {
                    "$ref": "#/$defs/consoleColor",
                    "default": "Yellow"
                }
            },
            "additionalProperties": false
        }
    },
    "$defs": {
        "consoleColor": {
            "type": "string",
            "enum": [
                "Black",
                "DarkBlue",
                "DarkGreen",
                "DarkCyan",
                "DarkRed",
                "DarkMagenta",
                "DarkYellow",
                "Gray",
                "DarkGray",
                "Blue",
                "Green",
                "Cyan",
                "Red",
                "Magenta",
                "Yellow",
                "White"
            ],
            "description": "Valid .NET ConsoleColor values"
        }
    },
    "additionalProperties": false
}